"","x"
"1","The National Cancer Institute Cancer Prevention Fellowship Program fellows are listed below in alphabetical order by last name."
"2","Prajakta Adsul"
"3","Year of entry 2016"
"4","Doctoral degree PhD, Public Health Studies, Saint Louis University, (2014)"
"5","MPH 2011, Epidemiology, Behavioral Sciences Saint Louis University"
"6","MBBS 2007, Medicine and Surgery, Maharashtra University of Health Sciences, Loni, India"
"7","Research Interests Implementation research, Global health, Health disparities, Socio-Behavioral and Health care delivery research. "
"8","Primary Preceptor/Branch David Chambers/Division of Cancer Control & Population Sciences/Office of the Director"
"9","Shelley Bluethmann"
"10","Year of entry 2014"
"11","Doctoral degree PhD, University of Texas, (2014)"
"12","MPH (if applicable) University of North Carolina, 2007"
"13","Research Interests Optimizing healthy aging in older cancer survivors, including the role of physical activity in mitigating cancer symptoms, improving co-morbidities, and enhancing quality of life."
"14","Primary Preceptor/Branch William Klein/Behavioral Research Program, Health Behaviors Research Branch"
"15","Megan Clarke"
"16","Year of entry 2016"
"17","Doctoral degree PhD, Cancer Epidemiology, Johns Hopkins University, Baltimore, MD (2016)"
"18","MHS, 2016, Biochemistry/Molecular Biology, Johns Hopkins University, Baltimore, MD"
"19","Research Interests Biomarker discovery and validation for early detection and prevention of gynecological cancers, risk prediction, translational epidemiology."
"20","Primary Preceptor/Branch Nicolas Wentzensen/Division of Cancer Epidemiology & Genetics/Clinical Genetics Branch"
"21","Diarmuid Coughlan"
"22","Year of Entry 2015"
"23","PhD, Health Economics, National University of Ireland, Galway, Ireland, (2014)"
"24","MPH N/A"
"25","Research Interests The economic burden of end-of-life cancer care stratifying by cancer type, stage of diagnosis and geographic location."
"26","Primary Preceptor/Branch Angela Mariotto/Division of Cancer Control & Population Sciences/Surveillance Research Program/Surveillance Informatics Branch"
"27","Brittny Davis"
"28","Year of entry 2015"
"29","Doctoral degree PhD, Chemistry, University of Maryland Baltimore County, (2015)"
"30","MPH Johns Hopkins University, 2016"
"31","Research Interests Modeling of national breast cancer trends, racial and geographic disparities in breast cancer, as well as risk prediction."
"32","Primary Preceptor/Branch William Anderson/Division of Cancer Epidemiology and Genetics/Biostatistics Branch"
"33","Maryam Doroudi"
"34","Year of Entry 2015"
"35","PhD, Molecular Biology, Georgia Institute of Technology, (2013)"
"36","MPH Johns Hopkins University, 2015"
"37","Research Interests Evaluate clinical and economic outcomes related to cancer screening and cancer treatment; Evaluating medical overuse; De-implementation Research."
"38","Primary Preceptor/Branch Paul Pinsky/Division of Cancer Prevention/Early Detection Research Group</p>"
"39","Danielle Durham"
"40","Year of entry 2016"
"41","Doctoral degree PhD, Epidemiology, The University of North Carolina at Chapel Hill, Chapel Hill, NC (2015)"
"42","MHS, 2008, Community Health Education, The University of North Carolina at Greensboro, Greensboro, NC"
"43","Research Interests Breast Cancer Epidemiology, Screening, Health Disparities, Health Services Research, Outcomes."
"44","Primary Preceptor/Branch Pamela Marcus/Division of Cancer Control & Population Sciences (DCCPS)/Epidemiology and Genomics Research Program"
"45","Erin Ellis"
"46","Year of Entry 2015"
"47","PhD, Community Health and Health Behavior, University at Buffalo, (2014) "
"48","MPH Johns Hopkins University, 2015"
"49","Research Interests The role of affect and emotion in health decision making; dual process models of cognition; risk perceptions as they relate to cancer screening and other behavioral risk factors."
"50","Primary Preceptor/Branch Rebecca Ferrer/Behavioral Research Program/Basic Biobehavioral and Psychological Sciences Branch"
"51","Felisa Gonzales"
"52","Year of entry 2013"
"53","Doctoral degree PhD, Applied Social Psychology, George Washington University, (2013)"
"54","MPH (if applicable) University of California – Berkeley, 2014 "
"55","Research Interests Disparities in cancer screening, treatment, and survival; health services research; health policy."
"56","Primary Preceptor/Branch Steve Taplin/Healthcare Delivery Research Program, Health Systems and Interventions Research Branch"
"57","Melinda Krakow"
"58","Year of entry 2015"
"59","Doctoral degree PhD, Health Communication, University of Utah, (2015)"
"60","MPH Johns Hopkins University, 2016"
"61","Research Interests Public health communication; narrative persuasion and media effects in the contexts of cancer prevention and screening; communication in healthcare systems; media coverage of cancer/science journalism."
"62","Primary Preceptor/Branch Brad Hesse/Division of Cancer Control & Population Sciences/Health Communication and Informatics Research Branch"
"63","Tamara Litwin"
"64","Year of entry 2015"
"65","Doctoral degree PhD, Biological Studies, University of Cambridge (United Kingdom), (2014)"
"66","MPH Johns Hopkins University, 2016"
"67","Research Interests Biomarker discovery and translation for prevention and early detection of gynecologic cancers, clinical trial design and implementation."
"68","Primary Preceptor/Branch Nicolas Wentzensen/Division of Cancer Epidemiology and Genetics/Clinical Genetics Branch"
"69","Claire Meaney"
"70","Year of Entry 2015"
"71","PhD, Biomedical Engineering, University of Limerick, (2013)"
"72","MPH University College Dublin, 2015"
"73","Research Interests The identification of biomarkers and molecular mechanisms associated with increased cancer risk and survival; the characterization of tumor microenvironment and its role in cancer progression; the development of 3D, tissue-mimetic models for cell behavior analysis."
"74","Primary Preceptor/Branch Brid Ryan/Center for Cancer Research/Human Carcinogenes Implementation Science"
"75","Jennifer Moss"
"76","Year of Entry 2015"
"77","PhD, Health Behavior, University of North Carolina, (2015)"
"78","MSPH University of North Carolina, 2012 (MPH)s"
"79","Research Interests Geographic disparities in cancer prevention behaviors, especially for HPV vaccination."
"80","Primary Preceptor/Branch Kathy Cronin/Division of Cancer Control & Population Sciences/Surveillance Research Program"
"81","Maeve Mullooly"
"82","Year of entry 2013"
"83","Doctoral degree PhD, Translational Medicine – Tumor Biology, University College Dublin, (2013)"
"84","MPH (if applicable) University College Dublin, 2014"
"85","Research Interests The molecular epidemiology of risk factors for breast cancer, especially mammographic breast density, and molecular mechanisms that drive its association with increased cancer risk."
"86","Primary Preceptor/Branch Gretchen Gierach/Hormonal and Reproductive Epidemiology Branch"
"87","Primary Preceptor/Branch Gretchen Gierach/Division of Cancer Epidemiology and Genetics/Metabolic Epidemiology Branch"
"88","Shakira Nelson"
"89","Year of entry 2013"
"90","Doctoral degree PhD, Immunology and Infectious Disease, Penn State University, (2013)"
"91","MPH (if applicable) Johns Hopkins University, 2014 "
"92","Research Interests The associations between nutrition, genetics, and metabolomics with prostate and other cancer development; and understanding the underlying impact of health disparities."
"93","Primary Preceptor/Branch Demetrius Albanes/Nutritional Epidemiology Branch"
"94","Minal Patel"
"95","Year of entry 2014"
"96","Doctoral degree PhD, Community Health Sciences, University of California — Los Angeles, (2014)"
"97","MPH (if applicable) San Diego State University, 2005"
"98","Research Interests The impact of social, built, and policy environments on cancer-related behaviors; tobacco use, physical activity, and nutrition behaviors related to cancer; multilevel factors involving neighborhood contextual and lifestyle factors; cancer health disparities; and adolescent/young adult cancer prevention."
"99","Primary Preceptor/Branch Linda Nebeling/Behavioral Research Program, Health Behaviors Research Branch – Tobacco Control "
"100","Research Branch"
"101","Carly Paterson"
"102","Year of entry 2015"
"103","Doctoral degree PhD, Nursing, University of South Florida, (2015)"
"104","MPH Dartmouth College, 2016"
"105","Research Interests Cancer survivorship, symptom management, palliative care, personalized medicine."
"106","Primary Preceptor/Branch Ann O'Mara/Division of Cancer Prevention/Community Oncology and Prevention Trials Research Group"
"107","Dudith Pierre-Victor"
"108","Year of Entry 2016"
"109","Doctoral Degree PhD, Public Health, Florida International University, Miami, FL (2016)"
"110","MPH 2011, Epidemiology, Florida International University, Miami, FL"
"111","Research Interests Coordination of cancer care; integration of primary care providers in cancer treatment planning; bidirectional communication between primary care providers and medical oncologists; patients’ experience and satisfaction with cancer care; enrollment of minority patients in oncology trials; and cancer disparities."
"112","Primary Preceptor/Branch Worta McCaskill-Stevens/Division of Cancer Prevention/Community Oncology and Prevention Trials Research Group"
"113","Kristen Pluchino"
"114","Year of entry 2016"
"115","Doctoral degree PhD, Oxford University, (2015)"
"116","MPH Harvard University (2017)"
"117","MS Johns Hopkins University"
"118","Research Interests Molecular targets; multidrug resistance; translational research; biomarker development; regulatory review."
"119","Katherine Rendle"
"120","Year of Entry 2015"
"121","PhD, Social Work, Anthropology, University of Michigan, (2014)"
"122","MPH University of California Berkeley, 2015"
"123","Research Interests Healthcare delivery and outcomes; cancer prevention and screening; patient-reported outcomes research; medical decision-making; social determinants of health; clinical epidemiology; medical anthropology."
"124","Primary Preceptor/Branch Sarah Kobrin/Healthcare Delivery Research Program/Health Systems and Interventions Research Branch"
"125","Megan Roberts"
"126","Year of Entry 2015"
"127","PhD, Health Policy and Management, University of North Carolina, (2015)"
"128","MPH N/A"
"129","Research Interests Health disparities, especially those related to access to precision medicine."
"130","Primary Preceptor/Branch William Klein/Division of Cancer Control & Population Sciences/Behavioral Research Program/Office of the Associate Director"
"131","Cendrine Robinson"
"132","Year of entry 2015"
"133","Doctoral degree PhD, Medical and Clinical Psychology, Uniformed Services University of the Health Sciences, (2015)"
"134","MPH Harvard University (2016)"
"135","Research Interests Using mobile health technology to deliver behavioral health interventions and smoking cessation among youth and ethnic minorities."
"136","Primary Preceptor/Branch Eric Augustson/Division of Cancer Control & Population Sciences/Behavioral Research Program/Tobacco Control Research Branch"
"137","Elizabeth Sarma"
"138","Year of entry 2016"
"139","Doctoral degree PhD, Psychology, Stony Brook University (2016)"
"140","MPH Harvard University (2017)"
"141","MA Stony Brook University"
"142","Research Interests Cancer prevention; health behavior; cancer screening; multiple health behavior change."
"143","Elizabeth Siembida"
"144","Year of entry 2016"
"145","Doctoral degree PhD, Human Development and Family Studies, University of Connecticut (2016)"
"146","MPH Johns Hopkins University, 2017"
"147","MA University of Connecticut"
"148","Research Interests Translational research in adolescent and young adult oncology."
"149","Michelle Silver"
"150","Year of Entry 2015"
"151","PhD, Epidemiology, Johns Hopkins University, (2015)"
"152","MPH Johns Hopkins University, 2009 (ScM)"
"153","Research Interests HPV, cervical cancer screening, prevention, translational epidemiology, and health services research."
"154","Primary Preceptor/Branch Mark Schiffman/Division of Cancer Epidemiology and Genetics/Clinical Genetics Branch"
"155","Susan Spillane"
"156","Year of entry 2016"
"157","Doctoral degree PhD, Cancer Pharmacoepidemiology, Trinity College, Dublin. (2015)"
"158","MPH London School of Hygiene & Tropical Medicine, 2017"
"159","MPh Royal College of Surgeons, Dublin, Ireland"
"160","Research Interests Cancer pharmacoepidemiology; biostatistics; chemoprevention outcomes; pharmacoeconomics; health economics; health policy."
"161","Calvin Tribby"
"162","Year of entry 2016"
"163","Doctoral degree PhD, Geography, Ohio State University, (2016)"
"164","MPH Columbia University, 2017"
"165","MS University of New Mexico in Albuquerque"
"166","Research Interests Active transportation; built environment; geographic information science; livability."
"167","Sabrina Tsang"
"168","Year of entry 2016"
"169","Doctoral degree PhD, Cell and Molecular Biology, University of Pennsylvania (2016)"
"170","MPH Harvard University (2017)"
"171","MS Biology, Massachusetts Institute of Technology"
"172","Research Interests Tumor viruses; virology; DNA damage response; oncogenesis; vaccines; clinical trials."
"173","Christopher Wheldon"
"174","Year of Entry 2015"
"175","PhD, Public Health, University of South Florida, (2015)"
"176","MPH University of South Florida, 2007 (MSPH)"
"177","Research Interests My research projects focus on providing a bettering understanding of disparities experienced by minority and underserved populations across the cancer control continuum with the ultimate goal of identifying modifiable factors (e.g., health behaviors, organizational norms, and policies) that could help decrease these disparities. "
"178","Primary Preceptor/Branch Richard Moser/Division of Cancer Control & Population Sciences/Behavioral Research Program/Science of Research and Technology Branch"
"179","Erik Willis"
"180","Year of entry 2016"
"181","Doctoral degree PhD, Exercise Physiology, University of Kansas (2016)"
"182","MPH Yale University, 2017"
"183","MS Health and Physical Activity, University of Pittsburgh"
"184","Research Interests Population and individual level physical activity; nutrition; health."
"185","Kara Wiseman"
"186","Year of Entry 2015"
"187","PhD, Epidemiology, Virginia Commonwealth University, (2015)"
"188","MPH Virginia Commonwealth University, 2011"
"189","Research Interests Behavioral intervention research, including study development, implementation and evaluation."
"190","Primary Preceptor/Branch Erik Augustson/Division of Cancer Control & Population Sciences/Behavioral Research Program/Tobacco Control Research Branch"
